{
  "$schema": "http://json-schema.org/draft-07/schema#",
  "$id": "committee_form.schema.json",
  "title": "Committee grader form (threshold-committee-eval P4)",
  "description": "One grader's gated grade for one slot. A grade counts ONLY with a form valid against this schema; _validate_form in committee_grade.py mirrors it by hand (no jsonschema dependency — plan deviation 7).",
  "type": "object",
  "additionalProperties": false,
  "required": ["slotId", "queryId", "arm", "chunks", "overall"],
  "properties": {
    "slotId": {
      "type": "string",
      "minLength": 1,
      "description": "Slot identity, \"<queryId>__<arm>\"."
    },
    "queryId": {
      "type": "string",
      "minLength": 1,
      "description": "Id of the query version the grader saw."
    },
    "arm": {
      "enum": ["off", "threshold"],
      "description": "Which retrieval arm produced the chunk list."
    },
    "chunks": {
      "type": "array",
      "minItems": 1,
      "description": "Exactly the hashes listed in the brief, each once; the per-chunk grade vector is compared across the trio (3/3 identical required, majority never accepted).",
      "items": {
        "type": "object",
        "additionalProperties": false,
        "required": ["hash", "grade", "reason"],
        "properties": {
          "hash": {
            "type": "string",
            "minLength": 1,
            "description": "Chunk hash exactly as given in the brief."
          },
          "grade": {
            "enum": ["A", "0"],
            "description": "A = 1 (the chunk answers the query), 0 = it does not (PoC rubric)."
          },
          "reason": {
            "type": "string",
            "minLength": 1,
            "description": "One-sentence justification for the grade."
          }
        }
      }
    },
    "overall": {
      "type": "string",
      "minLength": 1,
      "description": "One-sentence overall judgement; not part of the consistency vector."
    }
  }
}
