{
  "slotId": "C053__off",
  "queryId": "C053",
  "arm": "off",
  "chunks": [
    {
      "hash": "10a5467dd286e18dc8745a6a53c5b109acf1964e8d84fb474215d8d35da99d54",
      "grade": "0",
      "reason": "Chinese README describes the package's general purpose but does not explain how the mermaid plugin node is composed or wired into the graph."
    },
    {
      "hash": "fa83f28b10694317bbeeec76bda2d8b879d983c90da82d0dfc292c6f56e9067d",
      "grade": "0",
      "reason": "English README describes the package's functionality but does not address how its mermaid graph node is handled in composition."
    },
    {
      "hash": "001307d09219d7a2b94f643935cc9b812f8eeddba553ecbc92e58006e29f9682",
      "grade": "A",
      "reason": "Contains the mermaid composition graph showing plugin_dsh_base_tool_result_pruner and its edges, directly answering how it is handled in the graph."
    },
    {
      "hash": "0b58324c30984c338302ba86d77a9a0c62c77cc7f95dbe90320b00875f826f29",
      "grade": "A",
      "reason": "Config catalog documents how the plugin is registered and configured, which is part of how it is handled in the system."
    },
    {
      "hash": "32e94fafbe701ca038345ec3fee666440f7097f603b32acd9c30ffd6b258aada",
      "grade": "A",
      "reason": "Chinese config catalog provides the same plugin registration and configuration details as the English version."
    },
    {
      "hash": "7b3346c2cc4dfff9ad09053fd4885fad47125b817160dda0cc1e05942bf27a1a",
      "grade": "0",
      "reason": "Package.json contains only metadata, not how the mermaid plugin node is composed or handled."
    },
    {
      "hash": "0f3900c7429b24487a3a7ca8602b652b077e5495178f9e3c5e46b13d946836d2",
      "grade": "0",
      "reason": "Shows a different plugin (plugin_acp_acp_agent) in a mermaid graph, not the queried tool-result-pruner plugin."
    },
    {
      "hash": "473b26ed0926a54cad426a8af4780442fe4c32adad0fc75e0e3db8126bf3da43",
      "grade": "0",
      "reason": "ADR from a different project (ai-badger) about MCP tool index is irrelevant to how the mermaid plugin node is handled."
    }
  ],
  "overall": "Three chunks address the query: one shows the mermaid graph composition directly, and two config catalog entries document plugin registration and configuration."
}
