{
  "slotId": "C024__off",
  "queryId": "C024",
  "arm": "off",
  "chunks": [
    {
      "hash": "7919c74edd680689a72d99cc9cb5fa6e3d03e264edd2731493423aac62e9a08a",
      "grade": "A",
      "reason": "Shows the Managed by banner declaring HERMES.md source of truth is .ai-badger/HERMES.md."
    },
    {
      "hash": "7c0c3e8e537890d376e3002476f647dda7dbd3e1785c7cf5952f2f92de795224",
      "grade": "0",
      "reason": "Describes Hermes Agent configuration generally, not the Managed by banner handling."
    },
    {
      "hash": "ce42316307329c71cf6073a2b881e6659fa6cb70a2cbb160b83752ad7850dfe0",
      "grade": "0",
      "reason": "Discusses Hermes plugin gate plan status, not HERMES.md managed banner handling."
    },
    {
      "hash": "1c8e2de0e6452669b154671fab78880b738267d251da13b7c3336a27b20625e6",
      "grade": "0",
      "reason": "Shows the same banner pattern but for CLAUDE.md, not HERMES.md."
    },
    {
      "hash": "bdb232ef5f20ad29a04fe8eb3f77593216da67355b4cbc11fcdaf21dffd66170",
      "grade": "0",
      "reason": "Mentions a hermes provider protocol doc without addressing managed-file handling."
    },
    {
      "hash": "cc7888a972d38dc81cb530ecafe543e0868e2581d3e39a03ce3dee26d12cff28",
      "grade": "0",
      "reason": "Concerns hyphenated ai-raccoon directory naming, not the Managed by banner."
    },
    {
      "hash": "94e5c699e8e4a0037b79c44b8c1c16af21ed6066e5aeaa7ec8eb1b6bae966cdb",
      "grade": "0",
      "reason": "Covers Hermes skill discovery via symlinks, not HERMES.md managed handling."
    },
    {
      "hash": "fb87aea5792d20f831c34920ff65189bc74951fc492464d4190022b8dff0fbc9",
      "grade": "0",
      "reason": "Describes memory-first gate search scoping, not the Managed by banner."
    }
  ],
  "overall": "Only the first chunk directly answers how HERMES.md Managed by handling works."
}
