{
  "slotId": "C053__off",
  "queryId": "C053",
  "arm": "off",
  "chunks": [
    {
      "hash": "10a5467dd286e18dc8745a6a53c5b109acf1964e8d84fb474215d8d35da99d54",
      "grade": "0",
      "reason": "Describes pruner replay-safe pruning behavior, not the mermaid node wiring."
    },
    {
      "hash": "fa83f28b10694317bbeeec76bda2d8b879d983c90da82d0dfc292c6f56e9067d",
      "grade": "0",
      "reason": "Describes pruner service API and config, not the mermaid node wiring."
    },
    {
      "hash": "001307d09219d7a2b94f643935cc9b812f8eeddba553ecbc92e58006e29f9682",
      "grade": "A",
      "reason": "Contains the exact mermaid node and its cfg edge showing base-bundle wiring."
    },
    {
      "hash": "0b58324c30984c338302ba86d77a9a0c62c77cc7f95dbe90320b00875f826f29",
      "grade": "0",
      "reason": "Gives the pruner config declaration, not the mermaid diagram handling."
    },
    {
      "hash": "32e94fafbe701ca038345ec3fee666440f7097f603b32acd9c30ffd6b258aada",
      "grade": "0",
      "reason": "Gives the pruner config declaration in Chinese, not the mermaid diagram handling."
    },
    {
      "hash": "7b3346c2cc4dfff9ad09053fd4885fad47125b817160dda0cc1e05942bf27a1a",
      "grade": "0",
      "reason": "Shows package identity and description only, not the mermaid node handling."
    },
    {
      "hash": "0f3900c7429b24487a3a7ca8602b652b077e5495178f9e3c5e46b13d946836d2",
      "grade": "0",
      "reason": "Shows a different ACP composition diagram without the target dsh-base node."
    },
    {
      "hash": "473b26ed0926a54cad426a8af4780442fe4c32adad0fc75e0e3db8126bf3da43",
      "grade": "0",
      "reason": "Discusses MCP tool-index enrichment, unrelated to the mermaid pruner node."
    }
  ],
  "overall": "Only the CLI composition chunk directly shows the target mermaid node wiring."
}
