{
  "slotId": "C053__threshold",
  "queryId": "C053",
  "arm": "threshold",
  "chunks": [
    {
      "hash": "10a5467dd286e18dc8745a6a53c5b109acf1964e8d84fb474215d8d35da99d54",
      "grade": "0",
      "reason": "Chinese README describes pruner behavior but not the mermaid node wiring."
    },
    {
      "hash": "fa83f28b10694317bbeeec76bda2d8b879d983c90da82d0dfc292c6f56e9067d",
      "grade": "0",
      "reason": "English README describes pruner behavior but not the mermaid node wiring."
    },
    {
      "hash": "001307d09219d7a2b94f643935cc9b812f8eeddba553ecbc92e58006e29f9682",
      "grade": "A",
      "reason": "Shows the exact queried mermaid node and its incoming edge."
    },
    {
      "hash": "0b58324c30984c338302ba86d77a9a0c62c77cc7f95dbe90320b00875f826f29",
      "grade": "0",
      "reason": "Config catalog identifies the package without showing mermaid handling."
    },
    {
      "hash": "7b3346c2cc4dfff9ad09053fd4885fad47125b817160dda0cc1e05942bf27a1a",
      "grade": "0",
      "reason": "Package metadata alone does not explain mermaid handling."
    },
    {
      "hash": "0f3900c7429b24487a3a7ca8602b652b077e5495178f9e3c5e46b13d946836d2",
      "grade": "0",
      "reason": "ACP example graph lacks the queried tool-result-pruner node."
    },
    {
      "hash": "473b26ed0926a54cad426a8af4780442fe4c32adad0fc75e0e3db8126bf3da43",
      "grade": "0",
      "reason": "Unrelated ADR about MCP indexing, not this plugin wiring."
    },
    {
      "hash": "ac897c414168c56899e601be63d2488935ac8f1100d70cee3ca509a5f8b8ddd3",
      "grade": "0",
      "reason": "Shows neighboring compaction-basic node, not the queried pruner node."
    }
  ],
  "overall": "Only the CLI composition chunk answers the mermaid wiring question; the rest lack the queried node."
}
