{
  "slotId": "C024__off",
  "queryId": "C024",
  "arm": "off",
  "chunks": [
    {
      "hash": "7919c74edd680689a72d99cc9cb5fa6e3d03e264edd2731493423aac62e9a08a",
      "grade": "A",
      "reason": "States the exact Managed by ai-badger source-of-truth header for HERMES.md."
    },
    {
      "hash": "7c0c3e8e537890d376e3002476f647dda7dbd3e1785c7cf5952f2f92de795224",
      "grade": "0",
      "reason": "Describes Hermes Agent configuration, not the Managed-by marker handling."
    },
    {
      "hash": "ce42316307329c71cf6073a2b881e6659fa6cb70a2cbb160b83752ad7850dfe0",
      "grade": "0",
      "reason": "Discusses a Hermes plugin gate plan phase, not managed-file handling."
    },
    {
      "hash": "1c8e2de0e6452669b154671fab78880b738267d251da13b7c3336a27b20625e6",
      "grade": "0",
      "reason": "Shows the Managed-by template for CLAUDE.md rather than HERMES.md."
    },
    {
      "hash": "bdb232ef5f20ad29a04fe8eb3f77593216da67355b4cbc11fcdaf21dffd66170",
      "grade": "0",
      "reason": "Mentions a Hermes provider protocol doc, not the Managed-by mechanism."
    },
    {
      "hash": "cc7888a972d38dc81cb530ecafe543e0868e2581d3e39a03ce3dee26d12cff28",
      "grade": "0",
      "reason": "Addresses hyphenated directory naming, not Managed-by handling."
    },
    {
      "hash": "94e5c699e8e4a0037b79c44b8c1c16af21ed6066e5aeaa7ec8eb1b6bae966cdb",
      "grade": "0",
      "reason": "Covers skill discovery via symlinks, not the Managed-by marker."
    },
    {
      "hash": "fb87aea5792d20f831c34920ff65189bc74951fc492464d4190022b8dff0fbc9",
      "grade": "0",
      "reason": "Covers memory-first gate search scoping, not Managed-by handling."
    }
  ],
  "overall": "Only the HERMES.md header chunk answers how the Managed-by marker is handled."
}
