{
  "slotId": "C053__threshold",
  "queryId": "C034",
  "arm": "threshold",
  "chunks": [
    {
      "hash": "b79ed1bb3d590f391931817eebdc8f483f8477698da5722ef1e705100b825b11",
      "grade": "A",
      "reason": "Directly describes the ai-sheepdog bootstrap dated 2026-08-29."
    },
    {
      "hash": "65aa0a84a21dd11d16a51536a6058d999a36ecc5db443ab4240a0f79a11e7c70",
      "grade": "0",
      "reason": "About sqlite rsync evaluation verdict, not ai-sheepdog bootstrap."
    },
    {
      "hash": "473b26ed0926a54cad426a8af4780442fe4c32adad0fc75e0e3db8126bf3da43",
      "grade": "0",
      "reason": "About MCP tool index ADR enrichment, not ai-sheepdog bootstrap."
    },
    {
      "hash": "3d066f4eec82e20387f208544af2ce740da43b5956deefe208aa134b4985db62",
      "grade": "0",
      "reason": "About migration classification design, not ai-sheepdog bootstrap."
    },
    {
      "hash": "ce9cfa83fc3c622218013836f1698036321e7b798bfffa3804399fa281704efb",
      "grade": "0",
      "reason": "About generic new-project bootstrap resolver, not ai-sheepdog dated note."
    },
    {
      "hash": "ff2c3fbe553630b3341e30057727f1341a73a8c446322e1f8c51f6e8045ffd88",
      "grade": "0",
      "reason": "About bootstrap skills sync script, not ai-sheepdog bootstrap."
    },
    {
      "hash": "8e30041dc4de24787c42a17875d0173827888aaeffd3c3a7221297c4504754af",
      "grade": "0",
      "reason": "About generic bootstrap skills, not ai-sheepdog bootstrap."
    },
    {
      "hash": "182d981a84018bf72ca09d5dfda3c8707d8bc38d2f4249053f3cf70d195c2c53",
      "grade": "0",
      "reason": "About auto-grading null-projectId lines, not ai-sheepdog bootstrap."
    }
  ],
  "overall": "Only the top chunk answers the ai-sheepdog bootstrap query; the rest are off-topic."
}
