{
  "slotId": "C009__threshold",
  "queryId": "C009",
  "arm": "threshold",
  "chunks": [
    {
      "hash": "407ab320871af93171c4cf1cc74344476fa89db76922724126720c76aac5d5fa",
      "grade": "A",
      "reason": "Shows an instance of 'Managed by ai-badger' with its source-of-truth path (.ai-badger/HERMES.md), directly answering where this pattern is documented."
    },
    {
      "hash": "89269fc947f0769575ed33642f6274cf2d31d7aa4de5c9368948fb4312fa3ab8",
      "grade": "A",
      "reason": "Shows another instance of 'Managed by ai-badger' with a source-of-truth path (tooling/changelog_index.py), answering the documentation location question."
    },
    {
      "hash": "fa97c8d6cccca49bffcabd4976f30cdb13f8e4d8c9065b876aea4ec8e8527de6",
      "grade": "0",
      "reason": "Changelog entry about a disjoint-files isolation fix; contains no reference to where the 'Managed by ai-badger' pattern is documented."
    },
    {
      "hash": "e6732f9447884e24acb9e92a8e2d48d3a09643e14f2d5a63bcbd1f6edec6f114",
      "grade": "0",
      "reason": "From a different project (arasz-home-page); mentions ai-badger only as a version number, not about where the managed-by comment is documented."
    },
    {
      "hash": "37222c0cc2d1a299dedd307c9a7f5b837f063714dd933f83b8ef045679061064",
      "grade": "0",
      "reason": "ai-badger docs index listing documentation categories; does not specifically address where the 'Managed by ai-badger' comment pattern is documented."
    },
    {
      "hash": "7ebc94ff88e059975acbcbac4ec5247d408122dfc5d9b1cbbd70c66df9626bf0",
      "grade": "0",
      "reason": "Azure managed-identity invariant; 'managed' here refers to Azure identity authentication, not the ai-badger source-of-truth comment pattern."
    },
    {
      "hash": "93c92401e22959d3d78409fe2657d762fd6af232b12479827a8f94096d23d258",
      "grade": "0",
      "reason": "Getting-started guide explaining what ai-badger is and its scaffolding; does not mention where the 'Managed by' comment convention is documented."
    },
    {
      "hash": "6caf10f7635fb2f7ecd5de1a30c2b8ca8ae3f166959f97b23f37ed30a8ce1551",
      "grade": "0",
      "reason": "Bitwarden integration reference; 'owner-managed store' refers to a Bitwarden concept, not the ai-badger comment pattern."
    }
  ],
  "overall": "Chunks 1 and 2 directly answer the query by showing 'Managed by ai-badger' instances with their source-of-truth paths; the remaining six are unrelated to the documentation-location question."
}
