{
  "slotId": "C024__off",
  "queryId": "C097",
  "arm": "off",
  "chunks": [
    {
      "hash": "01403e0d71a083be480a730926646fdb349c4ec32157af9f3e45d25618c528ca",
      "grade": "A",
      "reason": "It contains the exact queried loc span from line 27 column 30 to line 29 column 1."
    },
    {
      "hash": "5811c3dae1f33ef85040596a3d12742da1370fe794ebeff2ba385055b7049e05",
      "grade": "0",
      "reason": "It shows only an unrelated line 146 span without the queried fragment."
    },
    {
      "hash": "4c0d171f23eeb11fdc4ab8295ee34c95809c87c7e261267e52364bef680507f9",
      "grade": "0",
      "reason": "It shows only line 27 columns 47 to 53 and not the queried loc."
    },
    {
      "hash": "4d94f44a980e6abd41894301201c3455f1faa03cb5ea3edc96492c1f1963c365",
      "grade": "0",
      "reason": "It shows only a line 38 to line 45 span without the queried fragment."
    },
    {
      "hash": "b5df94888abafbe967014c37389519958c3ea710759238d099cc5f8c1faa93f6",
      "grade": "0",
      "reason": "It shows only a line 72 span without the queried fragment."
    },
    {
      "hash": "8a2f22cdae5b555f74398a5d097775813c0a481bf3d1be50b8d86c9544e23b9d",
      "grade": "0",
      "reason": "It shows a nearby but different line 27 span that lacks the queried loc."
    },
    {
      "hash": "44856130a182143217817e46cca35214f3e2f9dee825b91ec8caef410829de97",
      "grade": "0",
      "reason": "It shows a nearby but different line 27 columns 0 to 18 span."
    },
    {
      "hash": "5be0e7d01eeb637a408745b6ac9aa0e1e1ccbec46fa3b28670e9858f20e65608",
      "grade": "0",
      "reason": "It shows only a line 13 span without the queried fragment."
    }
  ],
  "overall": "Only the first chunk contains the queried fragment while the rest show unrelated spans."
}
