{
  "slotId": "C050__off",
  "queryId": "C050",
  "arm": "off",
  "chunks": [
    {
      "hash": "d0bf2a54c94fefe4f0a8d38db5521a8ff4193b68a5cfe522fa1581d33974643f",
      "grade": "0",
      "reason": "Names the sibling darwin-arm64 package, not the queried darwin-x64 package."
    },
    {
      "hash": "5b11db44f7ce3edc0ac823031a08a7cd205be3bacf529ad77f79e469c7f28c57",
      "grade": "0",
      "reason": "Generic subagent package intro with no mention of darwin-x64 handling."
    },
    {
      "hash": "00c952c347ab8083b176f38ef1e8a49c437f637d38835837976062736bec08cc",
      "grade": "A",
      "reason": "Is the exact queried darwin-x64 row in the optional platform payload table."
    },
    {
      "hash": "34a8a4e8c86f57c7375e6b16996ddd0afadbc0c958d01987e4b774ad5d42838c",
      "grade": "0",
      "reason": "Names the sibling linux-x64 package, not the queried darwin-x64 package."
    },
    {
      "hash": "d420eed9db43acc809ad410ecb9d6a6daef4b10f28b28c0af95891610fd2bb7b",
      "grade": "0",
      "reason": "Generic English package intro with no darwin-x64 handling info."
    },
    {
      "hash": "ad8b69a39a14b0c29fa35b9fc93abc0760faebf9b922473073d9cf753c3e59a9",
      "grade": "0",
      "reason": "Names the sibling win32-x64 package, not the queried darwin-x64 package."
    },
    {
      "hash": "6c3aff35c60e3e8e664b6bffad3242b1feff0cf3a9d6b0c550207c46b156d3e9",
      "grade": "0",
      "reason": "Describes the pinned parent SDK and native claude generally without naming darwin-x64."
    },
    {
      "hash": "e85320a8fb51698f1eee891e2ddc0ca65d6677e1e53f41b95e3ed33d9dab7311",
      "grade": "0",
      "reason": "Shows only repository directory metadata with no dependency or payload handling."
    }
  ],
  "overall": "Only rank 3 directly answers with the exact darwin-x64 row; the rest are sibling-platform distractors or generic SDK context."
}
