{
  "slotId": "C024__off",
  "queryId": "C024",
  "arm": "off",
  "chunks": [
    {
      "hash": "7919c74edd680689a72d99cc9cb5fa6e3d03e264edd2731493423aac62e9a08a",
      "grade": "A",
      "reason": "Shows the exact Managed by ai-badger source-of-truth header in HERMES.md."
    },
    {
      "hash": "7c0c3e8e537890d376e3002476f647dda7dbd3e1785c7cf5952f2f92de795224",
      "grade": "0",
      "reason": "Describes Hermes Agent configuration generally, not the Managed-by header handling."
    },
    {
      "hash": "ce42316307329c71cf6073a2b881e6659fa6cb70a2cbb160b83752ad7850dfe0",
      "grade": "0",
      "reason": "Covers a Hermes plugin implementation plan phase, not the managed file marker."
    },
    {
      "hash": "1c8e2de0e6452669b154671fab78880b738267d251da13b7c3336a27b20625e6",
      "grade": "0",
      "reason": "Shows the analogous managed header but for CLAUDE.md, not HERMES.md."
    },
    {
      "hash": "bdb232ef5f20ad29a04fe8eb3f77593216da67355b4cbc11fcdaf21dffd66170",
      "grade": "0",
      "reason": "Discusses a hermes provider protocol doc, not managed-header handling."
    },
    {
      "hash": "cc7888a972d38dc81cb530ecafe543e0868e2581d3e39a03ce3dee26d12cff28",
      "grade": "0",
      "reason": "Discusses the hyphenated ai-raccoon directory name, not the managed marker."
    },
    {
      "hash": "94e5c699e8e4a0037b79c44b8c1c16af21ed6066e5aeaa7ec8eb1b6bae966cdb",
      "grade": "0",
      "reason": "Covers Hermes skill discovery via symlinks, not managed-file handling."
    },
    {
      "hash": "fb87aea5792d20f831c34920ff65189bc74951fc492464d4190022b8dff0fbc9",
      "grade": "0",
      "reason": "Covers memory-first gate search scoping, not the Managed by header."
    }
  ],
  "overall": "Only the first HERMES.md header chunk answers the query; the rest are wrong-file or off-topic."
}
