{
  "slotId": "C024__threshold",
  "queryId": "C024",
  "arm": "threshold",
  "chunks": [
    {
      "hash": "7919c74edd680689a72d99cc9cb5fa6e3d03e264edd2731493423aac62e9a08a",
      "grade": "A",
      "reason": "States the Managed-by header with source of truth and do-not-edit rule."
    },
    {
      "hash": "7c0c3e8e537890d376e3002476f647dda7dbd3e1785c7cf5952f2f92de795224",
      "grade": "0",
      "reason": "Describes .ai-badger as config source but not the Managed-by handling."
    },
    {
      "hash": "ce42316307329c71cf6073a2b881e6659fa6cb70a2cbb160b83752ad7850dfe0",
      "grade": "0",
      "reason": "Covers a Hermes plugin gate plan, not HERMES.md management."
    },
    {
      "hash": "bdb232ef5f20ad29a04fe8eb3f77593216da67355b4cbc11fcdaf21dffd66170",
      "grade": "0",
      "reason": "Discusses a provider protocol doc, not the Managed-by header."
    },
    {
      "hash": "cc7888a972d38dc81cb530ecafe543e0868e2581d3e39a03ce3dee26d12cff28",
      "grade": "0",
      "reason": "Discusses hyphenated directory naming, not HERMES.md management."
    },
    {
      "hash": "94e5c699e8e4a0037b79c44b8c1c16af21ed6066e5aeaa7ec8eb1b6bae966cdb",
      "grade": "0",
      "reason": "Covers skill discovery via symlinks, not HERMES.md management."
    },
    {
      "hash": "fb87aea5792d20f831c34920ff65189bc74951fc492464d4190022b8dff0fbc9",
      "grade": "0",
      "reason": "Covers memory-first gate search scoping, not HERMES.md management."
    },
    {
      "hash": "80e9aac24ceae2b4eedd71e45f48fe5a3f078c800601f3e28036555a2ce85d09",
      "grade": "0",
      "reason": "Mentions using a skill for plan tasks, not HERMES.md management."
    }
  ],
  "overall": "Only the first chunk answers how the Managed-by header is handled."
}
